{
  "$schema": "../../api/module.schema.json",
  "name": "audits",
  "displayName": "Audits",
  "version": "0.1.0",
  "description": "Audit universe scaffolds.",
  "requires": [],
  "capabilities": ["audits.plan", "audits.manage"],
  "migrations": [
    "database/migrations/0000_00_00_000300_create_audit_areas_table.php",
    "database/migrations/0000_00_00_000301_create_audit_plans_table.php"
  ],
  "settings": { "defaults": {} },
  "ui": { "nav": [ { "label": "Audits", "path": "/audits", "order": 40 } ] },
  "openapi": "openapi.yaml",
  "serviceProvider": "Modules\\Audits\\AuditsServiceProvider",
  "health": { "endpoint": "/api/audits/health" },
  "enabled": true
}
