{
  "$schema": "../../api/module.schema.json",
  "name": "compliance",
  "displayName": "Compliance",
  "version": "0.1.0",
  "description": "Regulatory and controls scaffolds.",
  "requires": [],
  "capabilities": ["compliance.regulations", "compliance.controls"],
  "migrations": [
    "database/migrations/0000_00_00_000200_create_frameworks_table.php",
    "database/migrations/0000_00_00_000201_create_controls_table.php"
  ],
  "settings": { "defaults": {} },
  "ui": { "nav": [ { "label": "Compliance", "path": "/compliance", "order": 30 } ] },
  "openapi": "openapi.yaml",
  "serviceProvider": "Modules\\Compliance\\ComplianceServiceProvider",
  "health": { "endpoint": "/api/compliance/health" },
  "enabled": true
}
