{
  "$schema": "../../api/module.schema.json",
  "name": "policies",
  "displayName": "Policies",
  "version": "0.1.0",
  "description": "Policy library scaffolds.",
  "requires": [],
  "capabilities": ["policies.manage"],
  "migrations": [
    "database/migrations/0000_00_00_000400_create_policies_table.php",
    "database/migrations/0000_00_00_000401_create_policy_versions_table.php"
  ],
  "settings": { "defaults": {} },
  "ui": { "nav": [ { "label": "Policies", "path": "/policies", "order": 50 } ] },
  "openapi": "openapi.yaml",
  "serviceProvider": "Modules\\Policies\\PoliciesServiceProvider",
  "health": { "endpoint": "/api/policies/health" },
  "enabled": true
}
